{
  "model": "mistralai/Mistral-7B-Instruct-v0.3",
  "task": "medqa_selective_prediction",
  "dataset": "GBaker/MedQA-USMLE-4-options",
  "peak_layer": 29,
  "protocol": {
    "target_ex_per_dim": 350,
    "probe_seeds": [
      42,
      43,
      44
    ]
  },
  "n_questions": 1000,
  "n_errors": 489,
  "accuracy": 0.511,
  "probe_seeds": [
    42,
    43,
    44
  ],
  "flag_rates": {
    "0.05": {
      "observer_exclusive": 19,
      "confidence_exclusive": 21,
      "both": 12,
      "pct_of_errors": 3.9
    },
    "0.1": {
      "observer_exclusive": 32,
      "confidence_exclusive": 41,
      "both": 22,
      "pct_of_errors": 6.5
    },
    "0.2": {
      "observer_exclusive": 55,
      "confidence_exclusive": 76,
      "both": 53,
      "pct_of_errors": 11.2
    },
    "0.3": {
      "observer_exclusive": 72,
      "confidence_exclusive": 105,
      "both": 82,
      "pct_of_errors": 14.7
    },
    "observer_auacc": -0.24930611118280355,
    "confidence_auacc": -0.2333558725462117
  },
  "per_question": [
    {
      "question": "A junior orthopaedic surgery resident is completing a carpal tunnel repair with the department chair",
      "answer": "A) Disclose the error to the patient and put it in the operative",
      "pred_letter": "A",
      "gold_letter": "B",
      "correct": false,
      "mean_observer": -2.8022262919694185,
      "mean_confidence": 0.998046875
    },
    {
      "question": "A 67-year-old man with transitional cell carcinoma of the bladder comes to the physician because of ",
      "answer": "C) Generation of free radicals",
      "pred_letter": "C",
      "gold_letter": "D",
      "correct": false,
      "mean_observer": -1.616123093912999,
      "mean_confidence": 0.96435546875
    },
    {
      "question": "Two weeks after undergoing an emergency cardiac catherization with stenting for unstable angina pect",
      "answer": "B) Cholesterol embolization",
      "pred_letter": "B",
      "gold_letter": "B",
      "correct": true,
      "mean_observer": -2.36738653977712,
      "mean_confidence": 0.9968749999999998
    },
    {
      "question": "A 39-year-old woman is brought to the emergency department because of fevers, chills, and left lower",
      "answer": "B) Encapsulated, gram-negative coccobacilli forming",
      "pred_letter": "B",
      "gold_letter": "D",
      "correct": false,
      "mean_observer": -2.4857287649065256,
      "mean_confidence": 0.999755859375
    },
    {
      "question": "A 35-year-old man comes to the physician because of itchy, watery eyes for the past week. He has als",
      "answer": "B) Ketotifen eye drops",
      "pred_letter": "B",
      "gold_letter": "B",
      "correct": true,
      "mean_observer": -2.4409039344017707,
      "mean_confidence": 0.9734374999999998
    },
    {
      "question": "A 39-year-old man presents to the emergency department because of progressively worsening chest pain",
      "answer": "D) Reassurance and continuous monitoring (initial step in managing a potential ac",
      "pred_letter": "D",
      "gold_letter": "D",
      "correct": true,
      "mean_observer": -1.1743552051484585,
      "mean_confidence": 0.7646484375
    },
    {
      "question": "A 68-year-old male comes to the physician for evaluation of right flank pain. He has a history of di",
      "answer": "D) Urethral stricture",
      "pred_letter": "D",
      "gold_letter": "C",
      "correct": false,
      "mean_observer": -1.9811660553570147,
      "mean_confidence": 0.9574652777777778
    },
    {
      "question": "A 65-year-old man is brought to the emergency department 30 minutes after the onset of acute chest p",
      "answer": "C) Clopidogrel",
      "pred_letter": "C",
      "gold_letter": "C",
      "correct": true,
      "mean_observer": -1.9817038166026275,
      "mean_confidence": 0.99853515625
    },
    {
      "question": "A 37-year-old-woman presents to her primary care physician requesting a new form of birth control. S",
      "answer": "B) Active or recurrent pelvic inflammatory disease (P",
      "pred_letter": "B",
      "gold_letter": "B",
      "correct": true,
      "mean_observer": -2.4160181830326715,
      "mean_confidence": 0.998046875
    },
    {
      "question": "A 23-year-old woman comes to the physician because she is embarrassed about the appearance of her na",
      "answer": "A) Silvery plaques on extensor surfaces",
      "pred_letter": "A",
      "gold_letter": "A",
      "correct": true,
      "mean_observer": -2.501718118372891,
      "mean_confidence": 0.9599609375
    },
    {
      "question": "A 24-year-old G2P1 woman at 39 weeks\u2019 gestation presents to the emergency department complaining of ",
      "answer": "D) It is an HIV-1/HIV2 antibody differentiation",
      "pred_letter": "D",
      "gold_letter": "D",
      "correct": true,
      "mean_observer": -2.1620430890470743,
      "mean_confidence": 0.999267578125
    },
    {
      "question": "A 72-year-old man comes to the physician because of a 2-month history of fatigue and worsening abdom",
      "answer": "D) Ruxolitinib",
      "pred_letter": "D",
      "gold_letter": "D",
      "correct": true,
      "mean_observer": -1.9109391172726948,
      "mean_confidence": 0.9995659722222222
    },
    {
      "question": "A 20-year-old man comes to the physician because of worsening gait unsteadiness and bilateral hearin",
      "answer": "D) Vascular malformations",
      "pred_letter": "D",
      "gold_letter": "B",
      "correct": false,
      "mean_observer": -1.7886414262466133,
      "mean_confidence": 0.99072265625
    },
    {
      "question": "A 47-year-old executive schedules an appointment his physician for a routine medical check-up. He cu",
      "answer": "D) A reduction in diastolic filling time",
      "pred_letter": "D",
      "gold_letter": "D",
      "correct": true,
      "mean_observer": -2.0986987099503027,
      "mean_confidence": 0.9719460227272728
    },
    {
      "question": "A microbiologist is studying the emergence of a virulent strain of the virus. After a detailed study",
      "answer": "A) Epstein-Barr virus (A) is capable of undergoing",
      "pred_letter": "A",
      "gold_letter": "C",
      "correct": false,
      "mean_observer": -1.0771333915181458,
      "mean_confidence": 0.9443359375
    },
    {
      "question": "A 59-year-old overweight woman presents to the urgent care clinic with the complaint of severe abdom",
      "answer": "D) Pancreatitis",
      "pred_letter": "D",
      "gold_letter": "B",
      "correct": false,
      "mean_observer": -2.159344413450786,
      "mean_confidence": 0.8772321428571429
    },
    {
      "question": "A 7-year-old boy is brought to his pediatrician\u2019s office for a follow-up visit. He was diagnosed wit",
      "answer": "C) IL-13",
      "pred_letter": "C",
      "gold_letter": "D",
      "correct": false,
      "mean_observer": -1.5583467071964627,
      "mean_confidence": 0.9988839285714285
    },
    {
      "question": "A 3-month-old boy is brought the emergency department by his parents after an episode of cyanosis an",
      "answer": "D) Matching",
      "pred_letter": "D",
      "gold_letter": "D",
      "correct": true,
      "mean_observer": -1.1394278141359486,
      "mean_confidence": 0.9875000000000002
    },
    {
      "question": "A 29-year-old man presents to the emergency department due to central chest pain over the past 3 day",
      "answer": "C) Pericardiocentesis",
      "pred_letter": "C",
      "gold_letter": "B",
      "correct": false,
      "mean_observer": -2.179457174959006,
      "mean_confidence": 0.9904513888888888
    },
    {
      "question": "A 46-year-old man is brought to the emergency department for evaluation of altered mental status. He",
      "answer": "B) Ethanol intoxication",
      "pred_letter": "B",
      "gold_letter": "D",
      "correct": false,
      "mean_observer": -1.9164699082849204,
      "mean_confidence": 0.9978298611111112
    },
    {
      "question": "A 77-year-old woman presents to the emergency room with the complaints of fever, malaise, and night ",
      "answer": "C) Previous radiation therapy",
      "pred_letter": "C",
      "gold_letter": "C",
      "correct": true,
      "mean_observer": -1.7546202279627323,
      "mean_confidence": 0.9972098214285715
    },
    {
      "question": "A 3-month-old infant is brought to her pediatrician because she coughs and seems to have difficulty ",
      "answer": "A) 22q11 deletion",
      "pred_letter": "A",
      "gold_letter": "A",
      "correct": true,
      "mean_observer": -2.1552636534201377,
      "mean_confidence": 0.9602272727272728
    },
    {
      "question": "A 30-year-old African American woman comes to the physician for the evaluation of a dry cough and ch",
      "answer": "B) Pneumocystis pneumonia",
      "pred_letter": "B",
      "gold_letter": "C",
      "correct": false,
      "mean_observer": -2.676607286839774,
      "mean_confidence": 0.9712357954545454
    },
    {
      "question": "A 62-year-old patient has been hospitalized for a week due to a stroke. One week into the hospitaliz",
      "answer": "A) Streptococcus pneumoniae",
      "pred_letter": "A",
      "gold_letter": "D",
      "correct": false,
      "mean_observer": -2.82351400785976,
      "mean_confidence": 0.98046875
    },
    {
      "question": "A 6-year-old boy is brought to the emergency department by his mother for worsening wheezing and sho",
      "answer": "A) Intubate with mechanical ventilation",
      "pred_letter": "A",
      "gold_letter": "A",
      "correct": true,
      "mean_observer": -2.3406791218866903,
      "mean_confidence": 0.9949218749999998
    },
    {
      "question": "A 5-year-old female suffers from recurrent infections by Aspergillus species, Pseudomonas species, a",
      "answer": "D) Respiratory burst",
      "pred_letter": "D",
      "gold_letter": "D",
      "correct": true,